{
  "schemaVersion": "1.0.0",
  "theme": "corporate-navy",
  "sectionOrder": ["summary", "skills", "work", "education", "openSource", "projects", "languages"],
  "basics": {
    "name": "Priyanka Chatterjee",
    "label": "Golang Backend Engineer — 3.5+ Years",
    "email": "priyankachatterjee9075@gmail.com",
    "phone": "+91 8617262536",
    "url": "https://priyanka-chatterjee-2000.github.io",
    "location": { "display": "Kolkata, West Bengal, India (open to remote)" },
    "profiles": [
      { "network": "LinkedIn", "url": "https://linkedin.com/in/priyanka-9075", "display": "linkedin.com/in/priyanka-9075" },
      { "network": "GitHub", "url": "https://github.com/Priyanka-Chatterjee-2000", "display": "github.com/Priyanka-Chatterjee-2000" }
    ],
    "activeSummary": "default",
    "summaries": {
      "default": "Backend Software Engineer building distributed, event-driven systems in Go across AWS, Azure, GCP, and OCI; core contributor to four Go-based open-source products (9,300+ GitHub stars, 120+ merged PRs) with shipped impact: 30% throughput gains, 70-90% resource-discovery latency cuts, and 40% query-performance improvements."
    }
  },
  "skills": [
    { "name": "Languages", "keywordsText": "Go, Python, TypeScript, SQL, Bash, HCL" },
    { "name": "Backend & APIs", "keywordsText": "Microservices, Event-Driven Architecture, Distributed Systems, REST, gRPC, GraphQL, WebSockets, Gin, Node.js" },
    { "name": "Messaging & Data", "keywordsText": "Apache Kafka (consumer groups, DLQs), PostgreSQL, DuckDB, Redis, Parquet" },
    { "name": "Cloud & DevOps", "keywordsText": "AWS, Azure, GCP, OCI, Docker, Kubernetes, Terraform, OpenTofu, GitHub Actions" }
  ],
  "work": [
    {
      "name": "Turbot HQ, Inc.",
      "location": "Remote",
      "dateDisplay": "August 2022 – April 2026",
      "roles": [
        { "position": "Software Engineer I", "dateDisplay": "August 2023 – April 2026" },
        { "position": "Junior Software Developer Intern", "dateDisplay": "August 2022 – July 2023" }
      ],
      "highlights": [
        "Designed and developed an internal REST API microservice in Go using the Gin framework to power the backend of Turbot Guardrails; secured endpoints with JWT client-token authentication, containerized with Docker, deployed to AWS EC2, and served as a gRPC client for internal microservices.",
        "Built a Kafka-based, fire-and-forget event-driven pipeline where consumers asynchronously processed policy-enforcement events and fired a webhook once a policy was enforced; added a dead-letter queue (DLQ) to capture recurring failures.",
        "Engineered core features for Tailpipe, a Go-based observability CLI on DuckDB + Parquet, lifting log-processing throughput 30% to 1,000+ logs per second and eliminating out-of-memory failures.",
        "Optimized complex PostgreSQL queries powering compliance audits, improving query performance 40% and eliminating a class of false-positive findings.",
        "Owned release engineering for four open-source Go CLIs, unifying GitHub Actions workflows and shipping HCL function-call support by extending the shared pipe-fittings Go library."
      ]
    }
  ],
  "education": [
    {
      "institution": "University of Engineering & Management (UEM)",
      "location": "Kolkata, WB, IN",
      "degreeDisplay": "Bachelor of Technology in Computer Science and Engineering",
      "dateDisplay": "August 2019 – May 2023",
      "score": "CGPA: 9.28"
    }
  ],
  "openSource": {
    "headline": "Core contributor across all four Turbot Go-based open-source products (Steampipe, Powerpipe, Flowpipe, Tailpipe): 120+ merged PRs and 4,200+ commits across 79 repositories, with 9,300+ combined GitHub stars.",
    "url": "https://github.com/pulls?q=author%3APriyanka-Chatterjee-2000+is%3Apr+is%3Amerged+org%3Aturbot",
    "urlLabel": "merged PR history"
  },
  "projects": [
    {
      "name": "Lila Tic-Tac-Toe — Real-Time Multiplayer Game",
      "dateDisplay": "2026",
      "description": "Nakama game server (Go core + TS runtime) on Fly.io with PostgreSQL; server-authoritative anti-cheat over WebSocket, mode-aware matchmaking, tick-based turn timer, and a top-10 leaderboard.",
      "links": [{ "label": "repo/live", "url": "https://priyanka-chatterjee-2000.github.io" }]
    }
  ],
  "languages": [
    { "language": "English", "fluency": "fluent" },
    { "language": "Bengali", "fluency": "native" },
    { "language": "Hindi", "fluency": "fluent" }
  ]
}
