{
  "schemaVersion": "1.0.0",
  "theme": "corporate-navy",
  "sectionOrder": ["summary", "skills", "work", "projects", "education"],
  "basics": {
    "name": "Priyanka Chatterjee",
    "label": "Gen AI Specialist · Python · LLM Agentic Systems (MCP, RAG) · 9,300★ Open-Source Contributor · 3.5+ Years",
    "email": "priyankachatterjee9075@gmail.com",
    "phone": "+91 8617262536",
    "url": "https://priyanka-chatterjee-2000.github.io",
    "location": {
      "display": "Kolkata, West Bengal, India",
      "city": "Kolkata",
      "region": "West Bengal",
      "countryCode": "IN"
    },
    "profiles": [
      {
        "network": "LinkedIn",
        "username": "priyanka-9075",
        "url": "https://linkedin.com/in/priyanka-9075",
        "display": "linkedin.com/in/priyanka-9075"
      },
      {
        "network": "GitHub",
        "username": "Priyanka-Chatterjee-2000",
        "url": "https://github.com/Priyanka-Chatterjee-2000",
        "display": "github.com/Priyanka-Chatterjee-2000"
      },
      {
        "network": "Portfolio",
        "url": "https://priyanka-chatterjee-2000.github.io",
        "display": "priyanka-chatterjee-2000.github.io"
      }
    ],
    "summaries": {
      "genai": "Gen AI Specialist with 3.5+ years of experience and expertise in Python, large language models (LLMs), prompt engineering, and multi-cloud platforms (AWS, Azure, GCP). Built a Model Context Protocol server and multi-agent LLM automation at Turbot HQ that cut Azure resource-discovery latency 70-90% and gave enterprise teams real-time AI-driven access to cloud security data."
    },
    "activeSummary": "genai"
  },
  "work": [
    {
      "name": "Turbot HQ, Inc.",
      "location": "Remote",
      "dateDisplay": "August 2022 – April 2026",
      "roleDisplay": "senior-only",
      "roles": [
        {
          "position": "Software Engineer I",
          "dateDisplay": "August 2022 – April 2026"
        }
      ],
      "highlights": [
        "Built the Steampipe Model Context Protocol (MCP) server end to end in Python, giving large language models (LLMs) standardized, real-time access to enterprise cloud and security data for retrieval and analysis.",
        "Designed a multi-agent workflow on the OpenAI Agents SDK, applying prompt engineering to orchestrate LLM agents that generate cloud preventive-policy commands, validate and test them in a live environment, self-correct failures, and score outcomes against an internal evaluation metric.",
        "Built a RAG-based Pydantic AI agent to preprocess and index internal documentation and code as text data into S3 vector storage; deployed it to AWS Lambda and integrated it with the Slack Bot API for instant developer query resolution.",
        "Authored an LLM-driven Claude Code skill automating code refactoring, unit test generation, deployment, and PR creation; used it to migrate 35+ Azure cloud-governance modules from polling to push-based eventing via Azure Event Grid, cutting resource-discovery latency 70–90% and eliminating recurring Azure API throttling.",
        "Engineered core features for Tailpipe, a Go-based observability/SIEM CLI on DuckDB + Parquet, lifting log-processing throughput 30% to 1,000+ logs per second by chunking and batching file reads and streaming writes to DuckDB; reduced memory use to eliminate out-of-memory failures.",
        "Resolved a production incident by diagnosing a Go service stuck in a Kubernetes CrashLoopBackOff, collaborating with the platform team to investigate pod logs and status and restore service.",
        "Added multi-distro Linux smoke tests to the GitHub Actions CI/CD release pipeline for four open-source Go CLIs, hardening release safety and catching regressions across Linux distributions before deployment."
      ]
    }
  ],
  "education": [
    {
      "institution": "University of Engineering & Management (UEM)",
      "location": "Kolkata, WB, IN",
      "degreeDisplay": "Bachelor of Technology in Computer Science and Engineering",
      "dateDisplay": "August 2019 – May 2023",
      "score": "CGPA: 9.28",
      "detail": "Relevant Coursework: Object-Oriented Programming, DBMS, Data Structures and Algorithms, Shell Scripting in Linux, Low-Level Design, High-Level Design"
    }
  ],
  "skills": [
    {
      "name": "Languages",
      "keywordsText": "Python, Go, Bash, SQL, TypeScript, JavaScript (ES6+)"
    },
    {
      "name": "Generative AI & Agentic Engineering",
      "keywordsText": "Large Language Models (LLMs), Prompt Engineering, Retrieval-Augmented Generation (RAG), Model Context Protocol (MCP), OpenAI Agents SDK, Pydantic AI, Multi-Agent Systems, Agentic Workflows, Logfire (LLM observability)"
    },
    {
      "name": "Cloud Platforms",
      "keywordsText": "AWS (Lambda, EC2, S3, SecurityHub, GuardDuty), Azure, GCP, OCI"
    },
    {
      "name": "Observability & Monitoring",
      "keywordsText": "Datadog, OpenTelemetry (OTel), Logfire; metrics, logging, tracing, incident triage"
    },
    {
      "name": "Containers & CI/CD",
      "keywordsText": "Docker, Kubernetes (working knowledge), GitHub Actions CI/CD, Git"
    },
    {
      "name": "Messaging & Event-Driven",
      "keywordsText": "Apache Kafka (consumer groups, DLQs), AWS SNS/SQS, AWS EventBridge, Azure Event Grid"
    },
    {
      "name": "Databases",
      "keywordsText": "PostgreSQL, MySQL, DuckDB, MongoDB, Redis (ElastiCache)"
    },
    {
      "name": "Testing & Quality",
      "keywordsText": "Unit Testing, Integration Testing, Automated CI Testing, Code Review"
    }
  ],
  "projects": [
    {
      "name": "General-Purpose AI Chatbot / Agent (Model Context Protocol)",
      "dateDisplay": "Jun 2025 – Aug 2025",
      "association": "",
      "description": "Agentic chatbot/agent framework built with Pydantic AI featuring configurable external MCP servers via a persistent MongoDB-backed registry, JSON config loader with strict input validation, per-server failure isolation, native tool calling, mid-conversation multi-model switching (OpenAI, Gemini, Anthropic, Mistral), conversation-history persistence, sync + streaming output, prompt-injection safeguards, and Logfire observability.",
      "links": []
    },
    {
      "name": "CIS Benchmark → Compliance Dashboard Generator",
      "dateDisplay": "",
      "association": "",
      "description": "Python CLI that automates compliance-dashboard authoring for a multi-cloud governance product. Preprocesses CIS benchmark XLSX workbooks (AWS, Azure) as text data and emits ready-to-deploy HCL dashboard config plus markdown docs. OOP resource model, custom HCL pretty-printer, openpyxl + pandas, distributed as a pip-installable package.",
      "links": []
    }
  ]
}
